{
  "contract_version": "1.0.0",
  "trajectory_id": "TRJ-20260919-TEST-STAGE-TEMP-F765FA",
  "experience_id": "EXP-20260919-TEST-STAGE-TEMP-F765FA",
  "project_id": "project_default",
  "task_id": "test_stage_temp",
  "ordered_actions": [
    {
      "step_number": 1,
      "action_type": "SKILL_INVOCATION",
      "actor": "statistics-agent",
      "timestamp": "2026-09-19T06:30:23.216587+00:00",
      "description": "Executed skill academic-suite-orchestrator for stage test_stage_temp",
      "observable_input": {
        "stage_dir": "/home/ghaderi-saber/Desktop/AcademicSuite/projects/test_stage_temp"
      },
      "observable_output": {
        "status": "FAILURE"
      }
    },
    {
      "step_number": 2,
      "action_type": "ARTIFACT_GENERATION",
      "actor": "statistics-agent",
      "timestamp": "2026-09-19T06:30:23.216587+00:00",
      "description": "Generated 3 physical artifacts in /home/ghaderi-saber/Desktop/AcademicSuite/projects/test_stage_temp",
      "observable_input": {
        "stage_dir": "/home/ghaderi-saber/Desktop/AcademicSuite/projects/test_stage_temp"
      },
      "observable_output": {
        "count": 3
      }
    }
  ],
  "tool_usages": [
    {
      "tool_name": "run_command",
      "invocation_index": 1,
      "arguments_summary": {
        "skill": "academic-suite-orchestrator",
        "stage": "test_stage_temp"
      },
      "status": "ERROR",
      "execution_time_ms": 1000
    }
  ],
  "skill_activations": [
    {
      "skill_name": "academic-suite-orchestrator",
      "script_path": ".agents/skills/academic-suite-orchestrator/scripts/academic-suite-orchestrator.py",
      "cli_command": "python3 .agents/skills/academic-suite-orchestrator/scripts/academic-suite-orchestrator.py",
      "exit_code": 1,
      "duration_seconds": 1.0
    }
  ],
  "subagent_delegations": [],
  "important_decisions": [],
  "outputs": [
    {
      "path": "projects/test_stage_temp/01_demographics.docx",
      "sha256": "aff03a3a5b3dcb227b7aeccc184fa772078ebd1aeda828be6305a032d9bce617",
      "type": "docx"
    },
    {
      "path": "projects/test_stage_temp/01_demographics.json",
      "sha256": "6dfca518a46a262ca06b8941df601ab37bfe02dd790a7e40a91b870ea8fdaad1",
      "type": "json"
    },
    {
      "path": "projects/test_stage_temp/01_demographics.md",
      "sha256": "707fa2a1ce5104d599bfda367396ecdb78f16658512793e5be1f1b681b83d1a3",
      "type": "md"
    }
  ],
  "validation_events": [
    {
      "validator_name": "TriadArtifactValidator",
      "verdict": "PASS",
      "failed_checks": [],
      "evidence_summary": {
        "docx": true,
        "md": true,
        "json": true
      }
    }
  ],
  "feedback": [],
  "outcome": "FAILURE"
}