{
  "contract_version": "1.0.0",
  "trajectory_id": "TRJ-20260918-STAGE-06-HYPOTHESIS-1-CF58EC",
  "experience_id": "EXP-20260918-STAGE-06-HYPOTHESIS-1-CF58EC",
  "project_id": "project_default",
  "task_id": "stage_06_hypothesis_1",
  "ordered_actions": [
    {
      "step_number": 1,
      "action_type": "SKILL_INVOCATION",
      "actor": "statistics-agent",
      "timestamp": "2026-09-18T18:12:04.820029+00:00",
      "description": "Executed skill statistical-data-analyst for stage stage_06_hypothesis_1",
      "observable_input": {
        "stage_dir": "/home/ghaderi-saber/Desktop/AcademicSuite/projects/study_act_burnout/03_deliverables/stage_06_hypothesis_1"
      },
      "observable_output": {
        "status": "SUCCESS"
      }
    },
    {
      "step_number": 2,
      "action_type": "ARTIFACT_GENERATION",
      "actor": "statistics-agent",
      "timestamp": "2026-09-18T18:12:04.820029+00:00",
      "description": "Generated 9 physical artifacts in /home/ghaderi-saber/Desktop/AcademicSuite/projects/study_act_burnout/03_deliverables/stage_06_hypothesis_1",
      "observable_input": {
        "stage_dir": "/home/ghaderi-saber/Desktop/AcademicSuite/projects/study_act_burnout/03_deliverables/stage_06_hypothesis_1"
      },
      "observable_output": {
        "count": 9
      }
    }
  ],
  "tool_usages": [
    {
      "tool_name": "run_command",
      "invocation_index": 1,
      "arguments_summary": {
        "skill": "statistical-data-analyst",
        "stage": "stage_06_hypothesis_1"
      },
      "status": "SUCCESS",
      "execution_time_ms": 1000
    }
  ],
  "skill_activations": [
    {
      "skill_name": "statistical-data-analyst",
      "script_path": ".agents/skills/statistical-data-analyst/scripts/statistical-data-analyst.py",
      "cli_command": "python3 .agents/skills/statistical-data-analyst/scripts/statistical-data-analyst.py",
      "exit_code": 0,
      "duration_seconds": 1.0
    }
  ],
  "subagent_delegations": [],
  "important_decisions": [],
  "outputs": [
    {
      "path": "projects/study_act_burnout/03_deliverables/stage_06_hypothesis_1/06_hypothesis_1.docx",
      "sha256": "70ca51e10f06a0bc1e7ad703d2d36fb394f0d65fa21d3796faf4a7c8b246295e",
      "type": "docx"
    },
    {
      "path": "projects/study_act_burnout/03_deliverables/stage_06_hypothesis_1/06_hypothesis_1.json",
      "sha256": "c5da0ac98c2b5ecc01776858e4687a1fff98128714d3fcbf1e495a038aaf7156",
      "type": "json"
    },
    {
      "path": "projects/study_act_burnout/03_deliverables/stage_06_hypothesis_1/06_hypothesis_1.md",
      "sha256": "f43c2bb04cec68f0735a1093082c578abee0e070312429d3783c861c798b74e1",
      "type": "md"
    },
    {
      "path": "projects/study_act_burnout/03_deliverables/stage_06_hypothesis_1/execution_manifest.json",
      "sha256": "623f68aae679e739eba411134a0a33e3357a3d1fd908719314d3d0710d8f4424",
      "type": "json"
    },
    {
      "path": "projects/study_act_burnout/03_deliverables/stage_06_hypothesis_1/pitfall_challenge_report.json",
      "sha256": "89d605a91d46585db14b0b001b7bc2460bff2d33c455205de7e515327aaf602d",
      "type": "json"
    },
    {
      "path": "projects/study_act_burnout/03_deliverables/stage_06_hypothesis_1/statistical_audit_report.json",
      "sha256": "7b37da51eebf7665d341378061b04960877722fe9364f78d0d5dd0186da09392",
      "type": "json"
    },
    {
      "path": "projects/study_act_burnout/03_deliverables/stage_06_hypothesis_1/stats_results.json",
      "sha256": "c5da0ac98c2b5ecc01776858e4687a1fff98128714d3fcbf1e495a038aaf7156",
      "type": "json"
    },
    {
      "path": "projects/study_act_burnout/03_deliverables/stage_06_hypothesis_1/stats_summary.md",
      "sha256": "e8b17006441ea8a443747168023fe6a2fd55af9685d6be2bef44527a3653a82d",
      "type": "md"
    },
    {
      "path": "projects/study_act_burnout/03_deliverables/stage_06_hypothesis_1/stats_table.md",
      "sha256": "d7e01704ced452f0b1a91d9bba1cb0d1666250b647558ee119ff6e4284d6d335",
      "type": "md"
    }
  ],
  "validation_events": [
    {
      "validator_name": "TriadArtifactValidator",
      "verdict": "PASS",
      "failed_checks": [],
      "evidence_summary": {
        "docx": true,
        "md": true,
        "json": true
      }
    }
  ],
  "feedback": [],
  "outcome": "SUCCESS"
}