{
  "contract_version": "1.0.0",
  "trajectory_id": "TRJ-20260918-STAGE-06-HYPOTHESIS-1-B40EE0",
  "experience_id": "EXP-20260918-STAGE-06-HYPOTHESIS-1-B40EE0",
  "project_id": "project_default",
  "task_id": "stage_06_hypothesis_1",
  "ordered_actions": [
    {
      "step_number": 1,
      "action_type": "SKILL_INVOCATION",
      "actor": "statistics-agent",
      "timestamp": "2026-09-18T20:46:50.471849+00:00",
      "description": "Executed skill statistical-data-analyst for stage stage_06_hypothesis_1",
      "observable_input": {
        "stage_dir": "/home/ghaderi-saber/Desktop/AcademicSuite/projects/test_study_e2e/03_deliverables/stage_06_hypothesis_1"
      },
      "observable_output": {
        "status": "SUCCESS"
      }
    },
    {
      "step_number": 2,
      "action_type": "ARTIFACT_GENERATION",
      "actor": "statistics-agent",
      "timestamp": "2026-09-18T20:46:50.471849+00:00",
      "description": "Generated 7 physical artifacts in /home/ghaderi-saber/Desktop/AcademicSuite/projects/test_study_e2e/03_deliverables/stage_06_hypothesis_1",
      "observable_input": {
        "stage_dir": "/home/ghaderi-saber/Desktop/AcademicSuite/projects/test_study_e2e/03_deliverables/stage_06_hypothesis_1"
      },
      "observable_output": {
        "count": 7
      }
    }
  ],
  "tool_usages": [
    {
      "tool_name": "run_command",
      "invocation_index": 1,
      "arguments_summary": {
        "skill": "statistical-data-analyst",
        "stage": "stage_06_hypothesis_1"
      },
      "status": "SUCCESS",
      "execution_time_ms": 1000
    }
  ],
  "skill_activations": [
    {
      "skill_name": "statistical-data-analyst",
      "script_path": ".agents/skills/statistical-data-analyst/scripts/statistical-data-analyst.py",
      "cli_command": "python3 .agents/skills/statistical-data-analyst/scripts/statistical-data-analyst.py",
      "exit_code": 0,
      "duration_seconds": 1.0
    }
  ],
  "subagent_delegations": [],
  "important_decisions": [],
  "outputs": [
    {
      "path": "projects/test_study_e2e/03_deliverables/stage_06_hypothesis_1/06_hypothesis_1.docx",
      "sha256": "1566197905886a890378220ad078003a5848aae3d77cb49da330fc614caff3da",
      "type": "docx"
    },
    {
      "path": "projects/test_study_e2e/03_deliverables/stage_06_hypothesis_1/06_hypothesis_1.json",
      "sha256": "7ffa7d92b96051bc599e48b76a97599146d0fe390c912db5560f03350b76b0cb",
      "type": "json"
    },
    {
      "path": "projects/test_study_e2e/03_deliverables/stage_06_hypothesis_1/06_hypothesis_1.md",
      "sha256": "4eea4a6fabcbe6639039064932559dd2eb0bc64ec117d549d427bea1f4b6cefe",
      "type": "md"
    },
    {
      "path": "projects/test_study_e2e/03_deliverables/stage_06_hypothesis_1/execution_manifest.json",
      "sha256": "b4b6b746fedb349d095ba144eb78726b6cea1824ea8856ad4aa1c3243051ba12",
      "type": "json"
    },
    {
      "path": "projects/test_study_e2e/03_deliverables/stage_06_hypothesis_1/stats_results.json",
      "sha256": "7ffa7d92b96051bc599e48b76a97599146d0fe390c912db5560f03350b76b0cb",
      "type": "json"
    },
    {
      "path": "projects/test_study_e2e/03_deliverables/stage_06_hypothesis_1/stats_summary.md",
      "sha256": "9943789aab9344a57f55c43c8178ce5170c5797cc48b77730a2b5d206aeabd01",
      "type": "md"
    },
    {
      "path": "projects/test_study_e2e/03_deliverables/stage_06_hypothesis_1/stats_table.md",
      "sha256": "bd0523a3f1fd3e7e6bc680d13501fe6eb24e03a4158d0d53b7dc8b9bf6af640c",
      "type": "md"
    }
  ],
  "validation_events": [
    {
      "validator_name": "statistical-auditor",
      "verdict": "PASS",
      "failed_checks": [],
      "evidence_summary": {
        "summary": "Stage validation verdict PASS"
      }
    }
  ],
  "feedback": [],
  "outcome": "SUCCESS"
}