{
  "contract_version": "1.0.0",
  "trajectory_id": "TRJ-20260920-STAGE-03-2EA9D0",
  "experience_id": "EXP-20260920-STAGE-03-2EA9D0",
  "project_id": "project_default",
  "task_id": "stage_03",
  "ordered_actions": [
    {
      "step_number": 1,
      "action_type": "VALIDATION_FAILED",
      "actor": "validation-agent",
      "timestamp": "2026-09-20T15:37:29.822652+00:00",
      "description": "Observed VALIDATION_FAILED",
      "observable_input": {
        "tool_name": "",
        "step_index": null
      },
      "observable_output": {
        "validator_name": "APA7Validator",
        "failed_checks": [
          "p_value_leading_zero"
        ],
        "stage_dir": "/tmp/test_hook_secondary_0ksmy80j/stage_03"
      }
    }
  ],
  "tool_usages": [],
  "skill_activations": [],
  "subagent_delegations": [],
  "important_decisions": [],
  "outputs": [],
  "validation_events": [
    {
      "validator_name": "TriadArtifactValidator",
      "verdict": "FAIL",
      "failed_checks": [
        "missing_triad_component"
      ],
      "evidence_summary": {
        "docx": false,
        "md": false,
        "json": false
      }
    }
  ],
  "feedback": [],
  "outcome": "FAILURE"
}