{
  "contract_version": "1.0.0",
  "trajectory_id": "TRJ-20260918-OUTPUTS-BBD0AF",
  "experience_id": "EXP-20260918-OUTPUTS-BBD0AF",
  "project_id": "project_default",
  "task_id": "outputs",
  "ordered_actions": [
    {
      "step_number": 1,
      "action_type": "SKILL_INVOCATION",
      "actor": "statistics-agent",
      "timestamp": "2026-09-18T17:42:18.280630+00:00",
      "description": "Executed skill academic-suite-orchestrator for stage outputs",
      "observable_input": {
        "stage_dir": "/home/ghaderi-saber/Desktop/AcademicSuite/projects/study_vertical_slice_sem/academic-state/outputs"
      },
      "observable_output": {
        "status": "SUCCESS"
      }
    },
    {
      "step_number": 2,
      "action_type": "ARTIFACT_GENERATION",
      "actor": "statistics-agent",
      "timestamp": "2026-09-18T17:42:18.280630+00:00",
      "description": "Generated 9 physical artifacts in /home/ghaderi-saber/Desktop/AcademicSuite/projects/study_vertical_slice_sem/academic-state/outputs",
      "observable_input": {
        "stage_dir": "/home/ghaderi-saber/Desktop/AcademicSuite/projects/study_vertical_slice_sem/academic-state/outputs"
      },
      "observable_output": {
        "count": 9
      }
    }
  ],
  "tool_usages": [
    {
      "tool_name": "run_command",
      "invocation_index": 1,
      "arguments_summary": {
        "skill": "academic-suite-orchestrator",
        "stage": "outputs"
      },
      "status": "SUCCESS",
      "execution_time_ms": 1000
    }
  ],
  "skill_activations": [
    {
      "skill_name": "academic-suite-orchestrator",
      "script_path": ".agents/skills/academic-suite-orchestrator/scripts/academic-suite-orchestrator.py",
      "cli_command": "python3 .agents/skills/academic-suite-orchestrator/scripts/academic-suite-orchestrator.py",
      "exit_code": 0,
      "duration_seconds": 1.0
    }
  ],
  "subagent_delegations": [],
  "important_decisions": [],
  "outputs": [
    {
      "path": "projects/study_vertical_slice_sem/academic-state/outputs/05_macro_model.docx",
      "sha256": "0d2984971af7956929d0c6b7786fd509bfb02b9d3a95017f80a0c9d8cd57cc28",
      "type": "docx"
    },
    {
      "path": "projects/study_vertical_slice_sem/academic-state/outputs/05_macro_model.json",
      "sha256": "8936b0da8f1f2ce88d51fb9c130a7a9cd485b02bb00b00b32c81d4e239805044",
      "type": "json"
    },
    {
      "path": "projects/study_vertical_slice_sem/academic-state/outputs/05_macro_model.md",
      "sha256": "fb07bdce4aa543a39be69b74b6d86f07a6ce42165a97a1dd7e3271e4b4b61560",
      "type": "md"
    },
    {
      "path": "projects/study_vertical_slice_sem/academic-state/outputs/06_hypothesis_1_direct_path.docx",
      "sha256": "574ba343e920643037bf1d0b8ca7e8498f2c323a0d5bec262c6af7303341f72e",
      "type": "docx"
    },
    {
      "path": "projects/study_vertical_slice_sem/academic-state/outputs/06_hypothesis_1_direct_path.json",
      "sha256": "4348620316674b5d0c2a1077a6320fab9a289e6f92d12a77c4b5e94757235192",
      "type": "json"
    },
    {
      "path": "projects/study_vertical_slice_sem/academic-state/outputs/06_hypothesis_1_direct_path.md",
      "sha256": "f0d3a7f6c6139ec97a3e8b81f7ff120350b86ae60894eb66a5ada62c34c4bad5",
      "type": "md"
    },
    {
      "path": "projects/study_vertical_slice_sem/academic-state/outputs/07_hypothesis_2_mediation.docx",
      "sha256": "67aa756ace260a15e427e4f07c8acd6abd5369725243523f9ebc103408f95529",
      "type": "docx"
    },
    {
      "path": "projects/study_vertical_slice_sem/academic-state/outputs/07_hypothesis_2_mediation.json",
      "sha256": "179128f213f03f3ee2914ea4bc21952207de589f00d29794e15179448e47050f",
      "type": "json"
    },
    {
      "path": "projects/study_vertical_slice_sem/academic-state/outputs/07_hypothesis_2_mediation.md",
      "sha256": "90b0d1f89982c7652669096d5beae1ef12e3004dd081add40d5e2370a50e3e25",
      "type": "md"
    }
  ],
  "validation_events": [
    {
      "validator_name": "TriadArtifactValidator",
      "verdict": "PASS",
      "failed_checks": [],
      "evidence_summary": {
        "docx": true,
        "md": true,
        "json": true
      }
    }
  ],
  "feedback": [],
  "outcome": "SUCCESS"
}